{
  "created_at": "2026-08-04T07:59:00+00:00",
  "hypothesis": "Efficiency rises at light-to-moderate load and then plateaus below 95%.",
  "id": "buck-efficiency",
  "objective": "Measure conversion efficiency and locate its observed peak across resistive loads.",
  "protocol": "Apply 12 V DC. Sweep ten resistive loads, wait for thermal stabilization, then record input/output voltage and current.",
  "schema": "benchlineage/study/v1",
  "tags": [
    "efficiency",
    "load-sweep",
    "power-electronics"
  ],
  "title": "Buck-converter load sweep"
}
